[
  {
    "question_text": "分析在氢/CO燃烧机理中，压力从1 atm升高到20 atm时，为何不同模型预测的层流火焰速度会出现显著分歧？请结合不确定度传播理论和反应速率参数的耦合效应进行解释。",
    "standard_answer": "该现象是不确定度传播的典型案例。在低压下，关键反应（如H+O2+M⇌HO2+M）的速率常数不确定度在高压力条件下被放大。",
    "original_text": {
      "1": "Polynomial chaos expansion... A model prediction y can be decomposed in terms of the basis functions y = ΣykJk。",
      "type": "concept",
      "difficulty": 4,
      "topic": "combustion_kinetics"
    },
    "type": "reasoning",
    "difficulty": 5,
    "topic": "combustion_kinetics",
    "question_id": "batch_detail_q_7cf7f1be",
    "source": {
      "type": "batch_generation",
      "paper_file": "Combustion-kinetic-model-uncertainty-quantifica_2015_Progress-in-Energy-and-",
      "paper_title": "Combustion-kinetic-model-uncertainty-quantifica_2015_Progress-in-Energy-and-"
    },
    "metadata": {
      "generation_model": "openai/deepseek-ai/DeepSeek-V3.2-Exp",
      "quality_check_model": "openai/deepseek-ai/DeepSeek-V3.2-Exp",
      "created_at": "2025-10-15T08:52:15.436415",
      "batch_processing": true,
      "answer_length": 60
    },
    "quality_check": {
      "domain_focused": true,
      "domain_reasoning": "该问题需要燃烧动力学、化学机理和不确定度传播的专业知识，涉及氢/CO燃烧机理中压力变化对层流火焰速度的影响机制分析，属于典型的燃烧科学和化学动力学领域问题。",
      "answer_correct": false,
      "answer_issues": [
        "too_brief",
        "unsupported",
        "fundamental_error"
      ],
      "other_compliant": true,
      "other_issues": [],
      "overall_verdict": "fail",
      "recommendation": "答案过于简短且缺乏关键支撑内容。需要详细解释：(1)不确定度传播理论如何在高压力下放大反应速率参数的不确定度；(2)反应速率参数的耦合效应如何导致模型分歧；(3)结合论文中的多项式混沌展开等UQ方法进行机制分析；(4)引用论文中关于压力相关反应(如H+O2+M⇌HO2+M)的具体影响机制。"
    }
  }
]