[
  {
    "question_text": "根据论文内容，氢储存在地质构造中的湿润性如何影响其储存能力和封存安全性？请详细分析湿润性在氢地质储存中的作用机理。",
    "standard_answer": "湿润性在地质储氢中起着关键作用，主要通过影响流体在多孔介质中的分布来控制储存能力和封存安全性。具体机理如下：\n1. 接触角(θ)决定流体分布：当θ<90°时为水湿状态，水相占据小孔隙和颗粒接触点；θ>90°时为气湿状态，氢气占据这些区域。论文中引用在323K和15MPa条件下，石英/H2/盐水系统的前进接触角θa=48.7°，表明中等湿润状态。\n2. 毛细管压力(Pc)与湿润性相关：Pc=2γcosθ/r，其中γ为界面张力，r为孔隙半径。较低的湿润性(θ增加)会导致毛细管压力降低，影响结构圈闭能力。\n3. 残余圈闭饱和度与湿润性密切相关：在θa<50°时有利于残余圈闭，而θr>90°可能导致氢气通过盖层泄漏。\n4. 有机酸污染会显著改变湿润性，如在10^-2 mol/L硬脂酸浓度下，方解石的θa可从64.6°增至115.85°，严重影响封存安全。",
    "original_text": {
      "1": "Wettability plays a critical role in the displacement of formation water and determines the containment safety, storage capacity, and amount of trapped H2 (or recovery factor)",
      "2": "For example, at 323 K and 15 MPa, when the stearic acid concentration increases from 10^-9 to 10^-2 mol/L, θr and θa increase from 68.7° and 75.85° (intermediate wetting) to 110.85° and 115.85° (weakly wetting)"
    },
    "type": "reasoning",
    "difficulty": 4,
    "topic": "fluid_mechanics",
    "question_id": "batch_detail_q_8bbcc462",
    "source": {
      "type": "batch_generation",
      "paper_file": "A-review-of-hydrogen-rock-brine-interaction--Im_2023_Progress-in-Energy-and-",
      "paper_title": "A-review-of-hydrogen-rock-brine-interaction--Im_2023_Progress-in-Energy-and-"
    },
    "metadata": {
      "generation_model": "openai/Pro/deepseek-ai/DeepSeek-V3",
      "quality_check_model": "openai/Pro/deepseek-ai/DeepSeek-V3",
      "created_at": "2025-10-15T07:21:46.100622",
      "batch_processing": true,
      "answer_length": 378
    },
    "quality_check": {
      "domain_focused": true,
      "domain_reasoning": "问题涉及氢地质储存的湿润性机理，需要燃烧/传热/流体/能源领域的专业知识",
      "answer_correct": true,
      "answer_issues": [],
      "other_compliant": true,
      "other_issues": [],
      "overall_verdict": "pass",
      "recommendation": "答案质量良好，建议保持"
    }
  },
  {
    "question_text": "分析温度对氢气在黏土矿物上湿润性的影响机理，并解释为什么这种影响在盖层密封评估中至关重要？",
    "standard_answer": "温度对黏土矿物湿润性的影响机理及其在盖层密封中的重要性分析如下：\n\n1. 温度影响的物理机理：\n- 分子动力学角度：温度升高增加H2分子动能，削弱其与黏土表面的范德华力相互作用\n- 密度效应：H2密度随温度升高而降低（343K,25MPa时为15.5kg/m³ vs 323K时16.4kg/m³），导致固-气相互作用减弱\n- 内聚能密度(CED)变化：H2的CED随温度升高而降低，而黏土矿物的CED基本不变\n\n2. 实验数据显示：\n- 在15MPa恒定压力下，云母/H2/盐水系统的θr和θa从308K时的47.3°和53.1°降至343K时的29.2°和35.4°\n- 这种变化趋势与方解石类似，但不同于石英（石英随温度升高湿润性降低）\n\n3. 对盖层密封的关键影响：\n- 湿润性降低（θ减小）意味着更强的水湿性，有利于毛细管密封\n- 盖层密封能力可用最大氢柱高度评估：h_max=2γcosθ/(Δρgr)，θ减小直接增加h_max\n- 在储层温度梯度下，上部较冷区域密封能力更强，形成自然封存梯度\n\n结论：温度引起的湿润性变化直接影响盖层毛细管封闭效率，是评估长期封存安全的关键参数",
    "original_text": {
      "1": "At the constant pressure of 15 MPa, θr and θa were 47.3° and 53.1° at 308 K, but at 343 K, they were 29.2° and 35.4°",
      "2": "This behavior is defined by the decrease in the density of the H2 gas while increasing the temperature"
    },
    "type": "reasoning",
    "difficulty": 5,
    "topic": "heat_transfer",
    "question_id": "batch_detail_q_390d3edd",
    "source": {
      "type": "batch_generation",
      "paper_file": "A-review-of-hydrogen-rock-brine-interaction--Im_2023_Progress-in-Energy-and-",
      "paper_title": "A-review-of-hydrogen-rock-brine-interaction--Im_2023_Progress-in-Energy-and-"
    },
    "metadata": {
      "generation_model": "openai/Pro/deepseek-ai/DeepSeek-V3",
      "quality_check_model": "openai/Pro/deepseek-ai/DeepSeek-V3",
      "created_at": "2025-10-15T07:22:03.382998",
      "batch_processing": true,
      "answer_length": 496
    },
    "quality_check": {
      "domain_focused": true,
      "domain_reasoning": "问题涉及氢气在黏土矿物上的湿润性及其对盖层密封影响的机理分析，需要燃烧/传热/流体/能源领域的专业知识。",
      "answer_correct": true,
      "answer_issues": [],
      "other_compliant": true,
      "other_issues": [],
      "overall_verdict": "pass",
      "recommendation": "答案详细阐述了温度对湿润性的影响机理，并提供了实验数据和理论分析，符合领域专业性和准确性要求。"
    }
  },
  {
    "question_text": "推导Washburn方程在粉末润湿性测量中的应用形式，并说明如何通过毛细渗透实验确定氢/盐水/煤系统的接触角。",
    "standard_answer": "Washburn方程在粉末润湿性测量中的推导及应用步骤如下：\n\n1. 基本Washburn方程：\nl² = (rγcosθ/2η)t\n其中：\nl - 液体渗透深度\nr - 等效毛细管半径\nγ - 液体表面张力\nθ - 接触角\nη - 液体粘度\nt - 时间\n\n2. 应用于煤粉系统的修正形式：\n对于不规则煤粉颗粒，引入形状因子C：\nl² = (Cγcosθ/η)t\n其中C通过已知接触角(θ=0°)的标准液体（如正己烷）标定\n\n3. 实验测定步骤：\na) 制备均匀粒径(0.5-1mm)的煤粉柱\nb) 使用标准液体测量C值\nc) 在高压容器中注入H2至目标压力(如10MPa)\nd) 记录盐水在煤粉柱中的上升高度l随时间t的变化\ne) 作l²-t图，斜率k= Cγcosθ/η\nf) 计算cosθ = kη/Cγ\n\n4. 注意事项：\n- 需控制温度恒定（使用恒温槽）\n- 孔隙半径r需通过压汞法单独测定\n- 高压条件下需修正γ和η的压力依赖性\n\n5. 数据处理示例：\n测得斜率k=0.02mm²/s，η=0.89cP，γ=72mN/m，C=3.5×10^-8m\n则cosθ = (0.02×10^-6)(0.89×10^-3)/[(3.5×10^-8)(72×10^-3)] ≈ 0.707 → θ≈45°",
    "original_text": {
      "1": "Washburn [335] suggested the capillary penetration method, which is applied for determining powder wettability, and observed the liquid penetration rate in a packed powder bed",
      "2": "The contact angle can be derived from the Washburn theory: l² = rtγlvcosθ/2η, where l is the liquid penetration depth, t denotes the penetration time, r represents the pore radius, and η indicates the liquid viscosity"
    },
    "type": "calculation",
    "difficulty": 4,
    "topic": "fluid_mechanics",
    "question_id": "batch_detail_q_71d30927",
    "source": {
      "type": "batch_generation",
      "paper_file": "A-review-of-hydrogen-rock-brine-interaction--Im_2023_Progress-in-Energy-and-",
      "paper_title": "A-review-of-hydrogen-rock-brine-interaction--Im_2023_Progress-in-Energy-and-"
    },
    "metadata": {
      "generation_model": "openai/Pro/deepseek-ai/DeepSeek-V3",
      "quality_check_model": "openai/Pro/deepseek-ai/DeepSeek-V3",
      "created_at": "2025-10-15T07:22:07.032817",
      "batch_processing": true,
      "answer_length": 553
    },
    "quality_check": {
      "domain_focused": true,
      "domain_reasoning": "问题涉及粉末润湿性测量和毛细渗透实验，需要燃烧/传热/流体/CFD/能源领域的专业知识",
      "answer_correct": true,
      "answer_issues": [],
      "other_compliant": true,
      "other_issues": [],
      "overall_verdict": "pass",
      "recommendation": "答案准确且详细，符合要求"
    }
  },
  {
    "question_text": "对比分析CO2和H2在地质储存中的湿润性差异及其对储存机制的影响，需要考虑哪些关键物理参数？这些差异对储存设计有何实际意义？",
    "standard_answer": "CO2与H2湿润性差异的系统对比分析如下：\n\n1. 关键物理参数差异：\n- 密度：25MPa/323K下CO2密度834.9kg/m³ vs H2仅16.4kg/m³\n- 界面张力：CO2/盐水IFT约25-35mN/m vs H2/盐水约72mN/m\n- 溶解度：CO2在水中溶解度(1.39m)远高于H2(0.139m)\n- 接触角：相同条件下CO2接触角通常比H2大20-30°\n\n2. 储存机制影响：\n- 结构圈闭：H2较高IFT补偿了较低的θ，毛细管压力Pc=2γcosθ/r可能相当\n- 残余圈闭：H2较低θ导致更高的残余饱和度(Sor)\n- 溶解储存：CO2溶解度高，溶解储存贡献大；H2几乎可忽略\n- 吸附储存：CO2在煤表面吸附量约为H2的5倍\n\n3. 设计意义：\n- 储存容量：H2需要更大孔隙体积补偿低溶解度和吸附量\n- 密封要求：H2低密度导致更强浮力，需要更严格盖层评估\n- 井距设计：H2更高流动性需要更密井网控制运移\n- 材料选择：H2小分子尺寸对井筒密封材料要求更高\n\n案例数据：在方解石表面，25MPa/323K下CO2的θa≈83.5°而H2≈42.9°，导致CO2的Pc比H2低约30%",
    "original_text": {
      "1": "At 25 MPa and 323 K, the densities of CO2 and H2 are 834.9 and 16.4 kg/m3, respectively",
      "2": "At similar physio-thermal conditions, θr and θa for the mica/CO2/brine system were 125° and 133° at 25 MPa, 323 K, and 10^-2 mol/L lignoceric acid concentration"
    },
    "type": "concept",
    "difficulty": 5,
    "topic": "energy_systems",
    "question_id": "batch_detail_q_6e5186c2",
    "source": {
      "type": "batch_generation",
      "paper_file": "A-review-of-hydrogen-rock-brine-interaction--Im_2023_Progress-in-Energy-and-",
      "paper_title": "A-review-of-hydrogen-rock-brine-interaction--Im_2023_Progress-in-Energy-and-"
    },
    "metadata": {
      "generation_model": "openai/Pro/deepseek-ai/DeepSeek-V3",
      "quality_check_model": "openai/Pro/deepseek-ai/DeepSeek-V3",
      "created_at": "2025-10-15T07:22:12.630393",
      "batch_processing": true,
      "answer_length": 512
    },
    "quality_check": {
      "domain_focused": true,
      "domain_reasoning": "该问题涉及CO2和H2在地质储存中的湿润性差异及其对储存机制的影响，需要燃烧/传热/流体/能源领域的专业知识，特别是关于流体性质、界面现象和多孔介质中的传输机制。",
      "answer_correct": true,
      "answer_issues": [],
      "other_compliant": true,
      "other_issues": [],
      "overall_verdict": "pass",
      "recommendation": "答案质量良好，提供了详细的物理参数对比和储存机制分析，并有论文摘录支持。建议在引用数据时明确指出数据来源的上下文（如实验条件）。"
    }
  }
]