[
  {
    "question_text": "在非氧化烘焙过程中，生物质从吸湿性向疏水性转变。请基于论文中描述的反应机制，详细解释这一转变背后的物理化学过程，并阐明这些过程如何协同作用以降低生物质的平衡水分含量。",
    "standard_answer": "生物质从吸湿性向疏水性的转变是烘焙过程的核心结果之一，其背后涉及多种物理化学反应机制的协同作用。首先，烘焙过程中的脱水反应是关键的起始步骤。如原文所述：'脱水反应会部分破坏生物质中的羟基基团。' 具体而言，纤维素和半纤维素中的大量羟基（-OH）是其能够通过氢键强烈吸附水分子，从而导致高吸湿性的主要原因。在200-300°C的烘焙温度下，半纤维素和部分纤维素发生热分解，伴随着脱羟基反应，这直接减少了可用于形成氢键的位点数量。其次，烘焙过程中会生成焦油，这些焦油在生物质颗粒内部的孔隙中冷凝。如原文进一步阐述：'形成的焦油在孔隙内冷凝可以降低饱和水分含量，并且由于冷凝焦油的非极性特性，还可以抑制潮湿空气通过固体，从而进一步阻止水蒸气在孔隙内的冷凝。原文明确指出：'疏水性的形成与羟基基团的去除和微孔的形成高度线性相关。' 冷凝的焦油由于其非极性特征，改变了孔隙表面的化学性质，使其从亲水变为疏水。这种转变的协同效应在于：脱水反应减少了整体的水分含量和羟基密度；脱羟基反应破坏了原有的亲水位点；而焦油冷凝则物理阻塞了水分传输路径。这些机制共同作用，导致了生物质表面接触角的显著增加（从原始木材的约65°增加到在230°C烘焙后的107°），并显著降低了其平衡水分含量（例如，从5.72%降至3.27%）。这种疏水性的增强显著提高了烘焙后生物质的储存耐久性，因为它限制了水分的吸收和随之而来的真菌生长。因此，烘焙过程通过引发这些化学和物理变化，有效地将生物质从一种容易吸水的材料转变为一种能够抵抗水分吸收的材料，这对于其作为固体燃料的长期储存和运输至关重要。",
    "original_text": {
      "1": "脱水反应会部分破坏生物质中的羟基基团。",
      "2": "形成的焦油在孔隙内冷凝可以降低饱和水分含量，并且由于冷凝焦油的非极性特性，还可以防止水蒸气通过孔隙。"
    },
    "type": "reasoning",
    "difficulty": 4,
    "topic": "combustion_kinetics",
    "question_id": "batch_detail_q_72b918f1",
    "source": {
      "type": "batch_generation",
      "paper_file": "Progress-in-biomass-torrefaction--Principles-_2021_Progress-in-Energy-and-Co",
      "paper_title": "Progress-in-biomass-torrefaction--Principles-_2021_Progress-in-Energy-and-Co"
    },
    "metadata": {
      "generation_model": "openai/deepseek-ai/DeepSeek-V3.2-Exp",
      "quality_check_model": "openai/deepseek-ai/DeepSeek-V3.2-Exp",
      "created_at": "2025-10-15T16:05:40.141046",
      "batch_processing": true,
      "answer_length": 678
    },
    "quality_check": {
      "domain_focused": true,
      "domain_reasoning": "该问题涉及生物质在非氧化烘焙过程中从吸湿性向疏水性转变的物理化学机制，这需要热化学转化、材料科学和表面化学等能源和燃烧领域的专业知识。",
      "answer_correct": true,
      "answer_issues": [],
      "other_compliant": false,
      "other_issues": [
        "has_meta_info"
      ],
      "overall_verdict": "fail",
      "recommendation": "答案存在元信息问题，应删除“如原文所述”、“原文明确指出”等引用性表述，直接陈述事实和机制。此外，验证显示焦油冷凝作用描述（防止水蒸气通过孔隙）与原文引用（抑制潮湿空气通过固体）略有差异，建议精确一致。总体内容完整、机理正确、引用充分。"
    }
  },
  {
    "question_text": "论文中提到，在烘焙过程中，生物质的原子H/C和O/C比降低，使其在van Krevelen图上更接近煤。请推导并解释在烘焙过程中，脱碳、脱氢和脱氧反应如何影响这些比率。假设原始生物质的元素组成为C: 47%, H: 6%, O: 45%（干基，质量分数）。假设在300°C下烘焙导致质量损失为30%，其中损失的挥发物组成（按质量计）为：C: 50%, H: 30%, O: 20%。计算并比较烘焙前后生物质的H/C和O/C原子比，并解释这种变化如何提高其作为燃料的品质。",
    "standard_answer": "为了分析烘焙过程中原子H/C和O/C比的变化，需要进行元素平衡计算。原始生物质（干基）的元素摩尔比为：n_C = 47/12 ≈ 3.917 mol, n_H = 6/1 = 6 mol, n_O = 45/16 ≈ 2.813 mol。初始H/C比 = 6 / 3.917 ≈ 1.532，O/C比 ≈ 2.813 / 3.917 ≈ 0.718。在300°C烘焙后，假设总质量损失30%，且损失的挥发物中C占50%、H占30%、O占20%。因此，损失的C摩尔数 = 30% * 50% / 12 = 0.125 mol。原始总干质量为100单位，烘焙后固体质量为70单位。损失的挥发物质量为30单位，其中损失的C质量为30*50% = 15单位，所以损失的C摩尔数 = 15/12 = 1.25 mol。损失的H摩尔数 = 30% * 30% / 1 = 0.09 mol。损失的O摩尔数 = 30% * 20% / 16 = 0.0375 mol。损失的O摩尔数 = 30% * 20% = 6单位，所以损失的O摩尔数 = 6/16 = 0.375 mol。因此，烘焙后固体中的C质量 = 47 - 15 = 32单位？不，我们需要基于元素组成进行计算。设原始生物质干基质量为100 g，则C: 47 g, H: 6 g, O: 45 g。烘焙后固体质量 = 70 g。假设烘焙过程主要发生脱氢和脱氧反应，而脱碳程度较小。原文指出：'脱碳、脱氢和脱氧反应导致这些原子从生物质中损失。' 然而，'脱碳程度比脱氢和脱氧程度要小。' 因此，烘焙后固体中保留的C比例较高。更精确地，损失的C部分 = (质量损失 * 挥发物中C%) / 原始C质量 = (30 * 50%) / 47 ≈ 15/47 ≈ 31.9%。损失的H部分 = (30 * 30%) / 6 = 9/6 = 1.5？更系统的计算：初始摩尔数：C: 47/12 ≈ 3.917, H: 6/1 = 6, O: 45/16 ≈ 2.813 mol。原始H/C原子比 = 6 / 3.917 ≈ 1.532。损失的挥发物中，C占50%，所以损失的C质量 = 30 * 50% = 15 g。因此，烘焙后固体中的C质量 = 47 - 15 = 32 g。类似地，损失的H质量 = 30 * 30% = 9 g，但原始H质量是6 g？这里似乎有数据不一致。基于论文中的一般趋势，烘焙后H/C和O/C比均会下降。例如，半纤维素（C5H8O4)n）在低温下优先分解，释放出富含H和O的化合物（如乙酸、水蒸气），而C相对保留更多。因此，烘焙后固体中C的相对含量增加，而H和O的相对含量减少。这导致能量密度增加，因为碳是热值的主要贡献者，而氧和氢的存在降低了热值。因此，烘焙通过选择性地去除氢和氧，提高了生物质的燃料品质。",
    "original_text": {
      "1": "脱碳、脱氢和脱氧反应导致这些原子从生物质中损失。",
      "2": "脱碳程度在烘焙过程中较低。"
    },
    "type": "calculation",
    "difficulty": 4,
    "topic": "combustion_kinetics",
    "question_id": "batch_detail_q_60ef87a7",
    "source": {
      "type": "batch_generation",
      "paper_file": "Progress-in-biomass-torrefaction--Principles-_2021_Progress-in-Energy-and-Co",
      "paper_title": "Progress-in-biomass-torrefaction--Principles-_2021_Progress-in-Energy-and-Co"
    },
    "metadata": {
      "generation_model": "openai/deepseek-ai/DeepSeek-V3.2-Exp",
      "quality_check_model": "openai/deepseek-ai/DeepSeek-V3.2-Exp",
      "created_at": "2025-10-15T16:05:54.177900",
      "batch_processing": true,
      "answer_length": 1187
    },
    "quality_check": {
      "domain_focused": true,
      "domain_reasoning": "问题涉及生物质烘焙过程的化学反应机理、元素平衡计算和燃料品质评估，需要燃烧科学、热化学转化和能源工程领域的专业知识",
      "answer_correct": false,
      "answer_issues": [
        "factual_error",
        "fundamental_error",
        "unsupported"
      ],
      "other_compliant": false,
      "other_issues": [
        "has_meta_info",
        "too_general"
      ],
      "overall_verdict": "fail",
      "recommendation": "答案存在严重的计算错误和概念混淆。需要重新进行准确的元素平衡计算，基于给定的原始数据和挥发物组成，系统计算烘焙前后各元素的质量和摩尔数，正确推导H/C和O/C比的变化。避免数据不一致和概念性错误。"
    }
  },
  {
    "question_text": "论文指出，烘焙动力学通常采用两步模型进行描述。请解释该模型的基本原理，包括涉及的伪组分、反应路径和速率常数。并讨论该模型在预测烘焙过程中质量损失动态方面的优势和局限性。",
    "standard_answer": "两步动力学模型是描述生物质烘焙过程中复杂反应网络的一种简化但有效的方法。该模型将生物质的热分解概念化为涉及三个主要伪组分：初始原料(A)、中间体(B)和最终炭或残余物(C)，而V1和V2代表挥发性产物。该模型假设存在两个主要的连续反应步骤。第一步反应（A → B + V1）通常归因于半纤维素和提取物的降解去除。而第二步反应（B → C + V2）则解释了中间体向最终炭产物的转化。反应速率常数ki（s⁻¹）对于每个反应通常使用阿伦尼乌斯定律计算，表达式为ki = Ai exp(-Ea,i / (R T))，其中i = A, B, C, V1, V2。在阿伦尼乌斯方程中，Ai是组分i的指前因子，Ea,i是组分i的活化能，R是通用气体常数，T是绝对温度。原文指出：'第一步反应发生的归因于半纤维素和提取物的降解去除。' 此外，'第二步反应解释了中间体向最终炭的转化。该模型的优势在于其相对简单，能够较好地拟合实验数据，特别是在烘焙的初始阶段（高达30%质量损失）。然而，该模型也存在局限性。例如，它可能无法完全捕捉所有并行发生的复杂反应，例如半纤维素、纤维素和木质素可能同时以不同的速率分解。原文进一步阐述：'该模型假设存在两个主要的连续反应步骤。' 该模型假设第一步反应速率较快，主要涉及半纤维素的解聚和挥发性产物的释放，而第二步则涉及更稳定的聚合物的分解。这种简化可能导致在更宽泛的条件或不同的生物质类型下预测出现偏差。例如，在高温或更长的停留时间下，反应可能变得更加复杂，涉及二次反应和交叉反应。因此，虽然两步模型为烘焙过程的动力学分析提供了一个实用的框架，但在应用时需要注意其假设条件和适用范围。",
    "original_text": {
      "1": "第一步反应发生的归因于半纤维素和提取物的降解去除。"
    },
    "type": "concept",
    "difficulty": 4,
    "topic": "CFD_modeling",
    "question_id": "batch_detail_q_705ecbda",
    "source": {
      "type": "batch_generation",
      "paper_file": "Progress-in-biomass-torrefaction--Principles-_2021_Progress-in-Energy-and-Co",
      "paper_title": "Progress-in-biomass-torrefaction--Principles-_2021_Progress-in-Energy-and-Co"
    },
    "metadata": {
      "generation_model": "openai/deepseek-ai/DeepSeek-V3.2-Exp",
      "quality_check_model": "openai/deepseek-ai/DeepSeek-V3.2-Exp",
      "created_at": "2025-10-15T16:06:05.156205",
      "batch_processing": true,
      "answer_length": 703
    },
    "quality_check": {
      "domain_focused": true,
      "domain_reasoning": "该问题涉及生物质烘焙动力学模型，需要热化学转化、反应动力学、生物质组分分解等燃烧和能源工程领域的专业知识",
      "answer_correct": false,
      "answer_issues": [
        "factual_error",
        "fundamental_error"
      ],
      "other_compliant": false,
      "other_issues": [
        "has_meta_info"
      ],
      "overall_verdict": "fail",
      "recommendation": "修正模型基本原理错误，删除元信息表述，确保伪组分定义和反应路径准确"
    }
  },
  {
    "question_text": "在生物质烘焙系统中，反应器是关键设施。请基于论文内容，详细比较固定床反应器、转鼓反应器和螺旋反应器在传热效率、温度控制、可扩展性和商业化潜力方面的优缺点。",
    "standard_answer": "不同类型的烘焙反应器在传热机制、温度均匀性、处理能力和运营成本方面存在显著差异。首先，固定床反应器：优点包括结构简单、成本低、易于实验室初步测试。然而，其缺点包括取样困难、传热差和温度控制不佳，这限制了其规模化和商业化。原文指出：'然而，固定床反应器的缺点包括取样困难以及传热和温度控制不佳，这限制了其可扩展性和商业化。' 具体而言，其内部温度梯度可能导致生物质热解机制的不均匀性。其次，转鼓反应器：作为一种连续系统，其优点在于通过反应器的连续旋转，可以实现壁与样品之间以及生物质内部的传导传热效应。' 相比之下，转鼓床具有连续操作的优点，但与其他类型（如对流和流化床反应器）相比，在相同烘焙条件下，其固体产率较低。原文进一步说明：'转鼓床的缺点是热效率低，这归因于间接加热、较少的活塞流和有限的可扩展性。' 第三，螺旋反应器（也称为auger反应器）是一种成熟的技术，主要通过一个或多个螺旋输送原料。然而，'不合适的控制条件可能导致工艺流动的阻塞。' 对于螺旋反应器，其传热主要通过壁或螺旋的空心部分进行间接加热。然而，不当的控制条件可能导致颗粒结块和产品质量差。' 因此，选择最合适的反应器类型取决于具体的原料、产品应用和成本考虑。因此，在设计和选择烘焙系统时，需要综合考虑这些因素，以优化性能和实现经济可行性。",
    "original_text": {
      "1": "然而，固定床反应器的缺点包括取样困难以及传热和温度控制不佳，这限制了其可扩展性和商业化。",
      "2": "转鼓床的缺点包括热效率低，这归因于间接加热、较少的活塞流和有限的可扩展性。",
      "type": "reasoning",
      "difficulty": 4,
      "topic": "energy_systems"
    },
    "type": "concept",
    "difficulty": 4,
    "topic": "energy_systems",
    "question_id": "batch_detail_q_99200649",
    "source": {
      "type": "batch_generation",
      "paper_file": "Progress-in-biomass-torrefaction--Principles-_2021_Progress-in-Energy-and-Co",
      "paper_title": "Progress-in-biomass-torrefaction--Principles-_2021_Progress-in-Energy-and-Co"
    },
    "metadata": {
      "generation_model": "openai/deepseek-ai/DeepSeek-V3.2-Exp",
      "quality_check_model": "openai/deepseek-ai/DeepSeek-V3.2-Exp",
      "created_at": "2025-10-15T16:06:18.478580",
      "batch_processing": true,
      "answer_length": 558
    },
    "quality_check": {
      "domain_focused": true,
      "domain_reasoning": "问题涉及生物质烘焙系统中不同类型反应器的传热效率、温度控制、可扩展性和商业化潜力，这些都需要燃烧工程、传热传质、反应器设计和能源系统领域的专业知识",
      "answer_correct": false,
      "answer_issues": [
        "unsupported"
      ],
      "other_compliant": false,
      "other_issues": [
        "has_meta_info",
        "too_general"
      ],
      "overall_verdict": "fail",
      "recommendation": "答案需要更多具体的技术细节支持，移除元信息，提供更精确的对比分析，减少通用性陈述"
    }
  }
]