[
  {
    "question_text": "基于论文中提供的层流燃烧速度经验模型SL = 0.85XCO + 1.19XH2 + 0.75XCH4 - 0.66XCO2 - 0.04XN2，计算一种典型生物质气化气（BGG）的层流燃烧速度，该气体组成为：H2=27%，CO=15%，CH4=25%，CO2=10%，N2=23%。并分析各组分对燃烧速度的贡献程度，解释为什么H2的系数最大而N2的系数最小。",
    "standard_answer": "计算过程：\n根据给定的BGG组成：XH2=0.27, XCO=0.15, XCH4=0.25, XCO2=0.10, XN2=0.23\n代入经验模型：\nSL = 0.85×0.15 + 1.19×0.27 + 0.75×0.25 - 0.66×0.10 - 0.04×0.23\n= 0.1275 + 0.3213 + 0.1875 - 0.066 - 0.0092\n= 0.5611 m/s = 56.11 cm/s\n\n各组分贡献分析：\n- H2贡献：1.19×0.27 = 0.3213 (57.3%)\n- CO贡献：0.85×0.15 = 0.1275 (22.7%)\n- CH4贡献：0.75×0.25 = 0.1875 (33.4%)\n- CO2负贡献：-0.66×0.10 = -0.066 (-11.8%)\n- N2负贡献：-0.04×0.23 = -0.0092 (-1.6%)\n\nH2系数最大的原因：H2具有极高的化学反应活性和扩散系数，其层流燃烧速度在空气中可达289 cm/s，远高于CO（19 cm/s）和CH4（37 cm/s）。H2燃烧过程中产生的H、O、OH等自由基能显著加速整个燃烧过程。\n\nN2系数最小的原因：N2作为惰性稀释剂，主要通过物理效应（增加热容量）降低燃烧温度，对化学反应路径影响较小。相比CO2（系数-0.66），N2的稀释效应较弱，因为CO2除了物理效应外还有化学效应（参与反应CO2 + H → CO + OH）。\n\n该计算结果56.11 cm/s与论文表5中BGG的层流燃烧速度范围（31.9-102.0 cm/s）相符，验证了经验模型的合理性。",
    "original_text": {
      "1": "SL = 0.85XCO + 1.19XH2 + 0.75XCH4 - 0.66XCO2 - 0.04XN2",
      "2": "Under atmospheric pressure and room temperature conditions, the maximum laminar burning velocity of CH4 in the air is 37 cm/s, and the maximum laminar burning velocity of CO in the air is 19 cm/s, significantly lower than that of CH4. For H2, the maximum laminar burning velocity in the air is considerably higher, i.e., 289 cm/s"
    },
    "type": "calculation",
    "difficulty": 3,
    "topic": "combustion_kinetics",
    "quality_check": {
      "domain_focused": true,
      "domain_reasoning": "问题涉及燃烧学中的层流燃烧速度计算、经验模型应用、气体组分对燃烧特性的影响分析，需要燃烧动力学、化学反应机理、燃料特性等专业领域知识",
      "answer_correct": true,
      "answer_issues": [],
      "other_compliant": true,
      "other_issues": [],
      "overall_verdict": "pass",
      "recommendation": ""
    },
    "retry_count": 0,
    "question_id": "deepseek_q_72652e8a",
    "source": {
      "type": "deepseek_generation",
      "paper_file": "MILD-combustion-of-low-calorific-valu_2024_Progress-in-Energy-and-Combustion",
      "paper_title": "MILD-combustion-of-low-calorific-valu_2024_Progress-in-Energy-and-Combustion"
    },
    "metadata": {
      "generation_model": "deepseek-chat",
      "created_at": "2025-10-15T11:38:52.673471",
      "answer_length": 699
    }
  },
  {
    "question_text": "基于论文中MILD燃烧的定义ΔT < Tsi < Tin，请详细分析LCVG中高含量H2和CO2对这两个关键条件的实现有何不同影响，并推导说明如何通过调整燃烧器参数来满足这些条件。",
    "standard_answer": "对于LCVG中高含量H2的情况：H2具有极高的反应活性（最大层流燃烧速度289 cm/s），这导致其自燃温度Tsi相对较低。但H2的高反应性也意味着在燃烧过程中会产生较大的温度升高ΔT。根据论文中定义，要实现MILD燃烧，需要确保ΔT < Tsi < Tin。对于H2-rich燃料，由于ΔT较大，需要通过更强的稀释来降低温度升高。这可以通过增加废气再循环（EGR）率或使用高速射流增强混合来实现。具体而言，当H2含量增加时，需要更高的稀释比KV（如论文图36所示，COG需要KV > 10）和更高的射流速度（>75 m/s）来确保ΔT < Tsi。\n\n对于高含量CO2的情况：CO2作为稀释剂，具有较高的热容量，能够有效降低燃烧温度。CO2的稀释效应包括物理效应（增加混合物热容量）和化学效应（通过反应CO2 + H → CO + OH影响自由基浓度）。根据论文分析，CO2稀释比N2更容易实现MILD燃烧，因为CO2能更有效地降低温度升高ΔT。对于含CO2的LCVG如沼气（CH4/CO2），由于CO2的稀释作用，ΔT条件较易满足，但需要更高的预热温度来满足Tin > Tsi条件。\n\n参数调整策略：对于H2-rich燃料，应优先考虑增加稀释水平和射流速度；对于CO2-rich燃料，应重点保证足够的预热温度。具体可通过调整EGR率、射流速度、预热温度等参数来优化满足MILD燃烧条件。",
    "original_text": {
      "1": "The presence of a large amount of dilution gas in LCVG increases the self-ignition temperature and ignition delay time of the mixture, making preheating the reactants a critical consideration. In MILD combustion, it is crucial to have an inlet reactant temperature higher than the self-ignition temperature (Tin > Tsi) to mitigate the difficulties associated with ignition and unstable combustion.",
      "2": "Hydrogen is the most reactive component in LCVG, and its content directly impacts the establishment, efficiency, and pollutant emissions of MILD combustion. Carbon dioxide, nitrogen, and water act as diluents, helping to reduce NOx emissions in MILD combustion."
    },
    "type": "reasoning",
    "difficulty": 4,
    "topic": "combustion_kinetics",
    "quality_check": {
      "domain_focused": true,
      "domain_reasoning": "问题涉及MILD燃烧原理、LCVG燃料特性、H2和CO2的化学/物理效应、燃烧器参数调整等，需要燃烧学、传热学、流体力学、化学反应动力学等专业领域知识。",
      "answer_correct": true,
      "answer_issues": [],
      "other_compliant": true,
      "other_issues": [],
      "overall_verdict": "pass",
      "recommendation": ""
    },
    "retry_count": 0,
    "question_id": "deepseek_q_5e496570",
    "source": {
      "type": "deepseek_generation",
      "paper_file": "MILD-combustion-of-low-calorific-valu_2024_Progress-in-Energy-and-Combustion",
      "paper_title": "MILD-combustion-of-low-calorific-valu_2024_Progress-in-Energy-and-Combustion"
    },
    "metadata": {
      "generation_model": "deepseek-chat",
      "created_at": "2025-10-15T11:38:53.235328",
      "answer_length": 595
    }
  },
  {
    "question_text": "分析PJFF（平行射流前向流动）燃烧器中空气/燃料动量比Maf对建立LCVG的MILD燃烧的影响机制，包括对流动结构、混合特性和污染物排放的具体影响。",
    "standard_answer": "在PJFF燃烧器中，空气/燃料动量比Maf定义为空气射流动量与燃料射流动量的比值，这个参数对建立LCVG的MILD燃烧具有决定性影响：\n\n流动结构影响机制：\n当Maf较高时（如A7F10配置，空气喷嘴直径7mm，燃料喷嘴直径10mm），空气射流主导流动场，产生强烈的回流和旋流运动。这种流动结构有利于热烟气的内部再循环，从而提高新鲜反应物的温度，满足Tin > Tsi的条件。然而，过高的Maf可能导致过早混合和局部高温区的形成。\n\n当Maf适中或较低时（如A7F1.8配置，Maf=2.2），燃料射流也能增强旋流运动，形成更均匀的混合。这种配置下，燃料和空气的混合更加延迟，有利于在整个燃烧室内建立分布式的反应区。\n\n混合特性影响：\n高Maf配置下，混合过程主要由空气射流控制，混合强度大但可能不均匀，容易形成传统的扩散火焰模式。低Maf配置下，燃料和空气射流共同作用，产生更复杂的涡结构，促进小尺度混合，有利于实现分布式反应。\n\n污染物排放影响：\n根据论文中Huang等人的实验结果：\n- A7F10配置（高Maf）：NOx排放>7 ppm，CO排放可达900 ppm，表现为传统扩散燃烧\n- A7F1.8配置（低Maf）：在当量比φ=0.6时，NOx排放5 ppm，CO排放3 ppm，实现超低污染物排放\n\n机理分析：\n合适的Maf（如A7F1.8）能够：\n1. 产生足够的内部EGR来预热反应物，满足Tin > Tsi\n2. 确保充分的稀释，满足ΔT < Tsi\n3. 提供足够的停留时间，保证燃料完全氧化\n4. 避免局部高温区的形成，抑制热力型NOx生成\n\n优化Maf的关键在于平衡混合强度与稀释程度，确保在满足MILD燃烧条件的同时，实现燃料的完全燃烧和污染物的最小化排放。",
    "original_text": {
      "1": "The parallel flow-forward burner (ABFB) is the optimal one, which can achieve the optimal conditions of MILD combustion. In this burner, when global equivalence ratio is 0.5, NOx emission is 4 ppm, and CO emission is 39 ppm.",
      "2": "For the A7F1.8 configuration, the NOx emission is 5 ppm, and CO emission is 3 ppm under an equivalent ratio of 0.6. The other two configurations have the potential for MILD combustion, but the CO emission is higher."
    },
    "type": "reasoning",
    "difficulty": 4,
    "topic": "fluid_mechanics",
    "quality_check": {
      "domain_focused": true,
      "domain_reasoning": "问题涉及PJFF燃烧器、空气/燃料动量比、MILD燃烧、流动结构、混合特性、污染物排放等专业概念，需要燃烧学、流体力学、传热学和CFD等领域的专业知识才能准确分析和回答。",
      "answer_correct": true,
      "answer_issues": [],
      "other_compliant": true,
      "other_issues": [],
      "overall_verdict": "pass",
      "recommendation": "无需改进，问题和答案均符合质量要求。"
    },
    "retry_count": 0,
    "question_id": "deepseek_q_e15682cc",
    "source": {
      "type": "deepseek_generation",
      "paper_file": "MILD-combustion-of-low-calorific-valu_2024_Progress-in-Energy-and-Combustion",
      "paper_title": "MILD-combustion-of-low-calorific-valu_2024_Progress-in-Energy-and-Combustion"
    },
    "metadata": {
      "generation_model": "deepseek-chat",
      "created_at": "2025-10-15T11:38:53.360200",
      "answer_length": 743
    }
  },
  {
    "question_text": "详细解释在LCVG的MILD燃烧中，CO2和H2O作为稀释剂时物理效应和化学效应的区别，并结合具体化学反应说明这些效应如何影响NOx排放。",
    "standard_answer": "CO2作为稀释剂的效应：\n物理效应：CO2具有较高的摩尔热容（约37 J/mol·K），能够有效吸收燃烧释放的热量，降低火焰温度。根据热力学原理，温度降低会显著抑制热力型NOx的生成，因为热力型NO的生成速率与温度呈指数关系（~exp(-E/RT)）。\n\n化学效应：CO2参与关键自由基反应：CO2 + H ⇌ CO + OH。这个反应既消耗了H自由基（H是链分支反应的重要参与者），又生成了OH自由基。OH自由基的生成有利于CO的氧化（OH + CO → CO2 + H），但H自由基的减少会降低整体反应速率。此外，CO2的存在还会影响CH4的氧化路径，促进中间产物如C2H2的形成。\n\nH2O作为稀释剂的效应：\n物理效应：H2O的摩尔热容更高（约33-40 J/mol·K，随温度变化），蒸汽的比热容也显著高于N2和CO2，因此具有更强的降温效果。\n\n化学效应：H2O参与多个重要反应：H2O + H ⇌ H2 + OH 和 H2O + O ⇌ 2OH。这些反应增加了OH自由基的浓度，而OH自由基是CO氧化的关键物种。H2O的存在还能促进H2的生成和消耗，影响整个反应网络的平衡。\n\n对NOx排放的影响机制：\n根据论文中Shu等人的研究，在相同稀释水平下，H2O稀释的MILD燃烧NO排放最低（1.8 ppm），其次是CO2（4.8 ppm），N2最高（58 ppm）。这种差异主要源于：\n1. H2O和CO2的物理降温效应比N2更强，有效抑制了热力型NO的生成\n2. H2O的化学效应通过增加OH浓度，促进了NO的再燃烧反应：NO + H → N + OH 和 NO + N → N2 + O\n3. CO2的化学效应通过改变自由基平衡，影响了N2O中间体路径的NO生成\n4. H2O稀释下氧浓度更低，进一步抑制了NO的生成\n\n这些效应共同作用，使得H2O和CO2作为稀释剂在MILD燃烧中能实现超低NOx排放。",
    "original_text": {
      "1": "For CO2, the chemical effect is the primary one, i.e., by reducing OH generation in the MILD combustion zone. In contrast, the physical effect is dominant in a conventional combustion zone. The physical effect is the primary for H2O irrespective of the MILD or conventional combustion zone.",
      "2": "Under the same dilution level, the maximum NO emissions in MILD combustion under N2, CO2, and H2O dilutions were 58, 4.8, and 1.8 ppm, respectively. The physical and chemical effects of H2O or CO2 worked together to reduce NO emissions."
    },
    "type": "concept",
    "difficulty": 5,
    "topic": "combustion_kinetics",
    "quality_check": {
      "domain_focused": true,
      "domain_reasoning": "问题涉及燃烧学、化学反应动力学、热力学和污染物排放控制等专业领域，需要燃烧/传热/流体/CFD/能源领域的专业知识来理解MILD燃烧机制、稀释剂效应和NOx生成机理",
      "answer_correct": true,
      "answer_issues": [],
      "other_compliant": true,
      "other_issues": [],
      "overall_verdict": "pass",
      "recommendation": "答案质量优秀，无需修改。答案准确区分了CO2和H2O的物理与化学效应，提供了具体的化学反应机制和NOx排放数据，并正确引用了相关研究结果"
    },
    "retry_count": 0,
    "question_id": "deepseek_q_82cee68d",
    "source": {
      "type": "deepseek_generation",
      "paper_file": "MILD-combustion-of-low-calorific-valu_2024_Progress-in-Energy-and-Combustion",
      "paper_title": "MILD-combustion-of-low-calorific-valu_2024_Progress-in-Energy-and-Combustion"
    },
    "metadata": {
      "generation_model": "deepseek-chat",
      "created_at": "2025-10-15T11:38:55.013166",
      "answer_length": 809
    }
  }
]