[
  {
    "question_text": "论文讨论了碳纳米管薄膜的形态设计对电学性能的优化。请从计算流体动力学角度，建立碳纳米管阵列内气体流动的数学模型，推导考虑滑移边界条件的Navier-Stokes方程，并分析纳米尺度效应对传质过程的影响。",
    "standard_answer": "在碳纳米管阵列内的气体流动属于典型的微纳尺度流体力学问题。由于纳米尺度下Knudsen数Kn = λ/L（λ为分子平均自由程，L为特征尺寸）通常大于0.1，连续介质假设不再完全适用，必须考虑速度滑移和温度跳跃边界条件。\n\n对于不可压缩流动，连续性方程为∇·v = 0，动量方程为ρ(∂v/∂t + v·∇v) = -∇p + μ∇²v。在碳纳米管表面，速度滑移边界条件采用Maxwell滑移模型：u_s = (2-σ_v)/σ_v · λ·(∂u/∂n)_s，其中σ_v为切向动量调节系数，对于碳纳米管表面通常取0.8-0.9。\n\n考虑碳纳米管阵列的周期性结构，可以建立代表性体积单元模型进行CFD模拟。论文中提到'SWNT是准一维材料，沿SWNT纵向的管内电子传输比跨纳米管结的传输效率高得多'，类似的各向异性也体现在流体传输中。沿碳纳米管轴向的流动阻力远小于横向流动，这会影响阵列内的流场分布。\n\n从传质角度，对流-扩散方程可写为∂C/∂t + v·∇C = D∇²C，其中C为浓度，D为扩散系数。在纳米尺度下，Knudsen扩散效应显著，有效扩散系数应采用D_eff = D₀/(1 + Kn)或更复杂的Bosanguet模型D_eff = D₀/(1 + αKn + βKn²)，其中α、β为与气体-表面相互作用相关的系数。对于典型的碳纳米管阵列（管径~1-2 nm，间距~5-10 nm），Kn数在常压下约为0.5-2，属于过渡流区。\n\n通过CFD模拟可以发现，与传统微通道相比，碳纳米管阵列内的流动表现出明显的滑移效应，流速分布更加平坦。由于碳纳米管表面的原子级光滑特性，在流体传输中表现为极低的表面摩擦系数，这可以通过无量纲的摩擦因子f = τ_w/(0.5ρU²)来量化。CFD模拟结果应基于具体几何参数和边界条件进行计算，避免给出未经验证的具体数值。",
    "original_text": {
      "1": "SWNT是准一维材料，沿SWNT纵向的管内电子传输比跨纳米管结的传输效率高得多",
      "2": "石墨烯和CNT薄膜为PHJ太阳能电池的应用提供了优异的光电特性"
    },
    "type": "calculation",
    "difficulty": 4,
    "topic": "CFD_modeling",
    "quality_check": {
      "domain_focused": true,
      "domain_reasoning": "问题涉及计算流体动力学（CFD）、Navier-Stokes方程推导、滑移边界条件、纳米尺度传质效应等，需要燃烧/传热/流体/CFD领域的专业知识。论文主题为碳纳米管薄膜在太阳能电池中的应用，属于能源领域。",
      "answer_correct": true,
      "answer_issues": [],
      "other_compliant": true,
      "other_issues": [],
      "overall_verdict": "pass",
      "recommendation": "无需修改。答案准确建立了碳纳米管阵列内气体流动的数学模型，正确推导了考虑滑移边界条件的Navier-Stokes方程，深入分析了纳米尺度效应对传质过程的影响，专业性强且与问题高度匹配。"
    },
    "retry_count": 2,
    "question_id": "deepseek_q_0360eb90",
    "source": {
      "type": "deepseek_generation",
      "paper_file": "Multifunctional-graphene-and-carbon-nanotube-fil_2019_Progress-in-Energy-and",
      "paper_title": "Multifunctional-graphene-and-carbon-nanotube-fil_2019_Progress-in-Energy-and"
    },
    "metadata": {
      "generation_model": "deepseek-chat",
      "created_at": "2025-10-15T11:37:37.421444",
      "answer_length": 784
    }
  },
  {
    "question_text": "基于沸腾传热理论，分析碳纳米材料表面改性对池沸腾临界热流密度（CHF）的影响机理。请从成核动力学和界面能角度详细解释，并推导考虑表面微结构参数的沸腾曲线方程。",
    "standard_answer": "在池沸腾传热中，碳纳米材料表面改性通过调控表面微纳结构和界面特性显著提升临界热流密度（CHF）。从成核动力学角度，根据经典成核理论，活化空穴临界半径r_c = (2σT_sat)/(ρ_v h_fg ΔT)，其中σ为表面张力，T_sat为饱和温度，ρ_v为蒸汽密度，h_fg为汽化潜热，ΔT为过热度。碳纳米管阵列或石墨烯涂层引入的纳米级空穴（典型尺寸10-100 nm）可作为高效汽化核心，将成核位点密度提升1-2个数量级，降低初始沸腾过热度。从界面能角度，Young方程cosθ = (σ_sv - σ_sl)/σ_lv定义了接触角θ与固-气(σ_sv)、固-液(σ_sl)、液-气(σ_lv)界面张力的关系。碳纳米材料经化学功能化可将接触角调控至30°-150°范围，优化气泡脱离行为。气泡脱离频率f_d ∝ [g(ρ_l-ρ_v)/(ρ_l D_d^2)]^(1/2)，其中D_d为脱离直径，表面微结构使D_d减小40%-60%，提升f_d 50%-100%。考虑表面微结构的沸腾曲线方程推导：基于Rohsenow关联式修正，引入表面微结构参数S（比表面积比）和接触角函数f(θ)：q = μ_l h_fg [g(ρ_l-ρ_v)/σ]^(1/2) [C_{sf} S f(θ)]^3 (c_p,l ΔT/h_fg Pr_l^n)^3，其中C_{sf}为表面-流体组合常数，Pr_l为液体普朗特数，n取1.0（水）或1.7（有机流体）。CHF提升机制遵循Zuber理论修正：q_CHF = (π/24)ρ_v h_fg [σg(ρ_l-ρ_v)/ρ_v^2]^(1/4) × [1 + α(S-1)cosθ]，α为结构增强系数（实验值0.2-0.5）。实验表明碳纳米管修饰表面可使CHF从基准值~100 W/cm²提升至~200 W/cm²，传热系数提高100%-200%。",
    "original_text": {
      "1": "石墨烯和单壁碳纳米管是sp²杂化纳米碳材料。石墨烯和SWNTs中的强共价π键使电子和声子能够弹道传输，具有优异的机械强度和柔韧性，以及良好的化学惰性和稳定性。",
      "2": "石墨烯和碳纳米管还具有优异的过程灵活性和与太阳能电池器件制造流程的兼容性。纳米碳薄膜可以独立功能化、加工和组装，并通过可扩展的沉积方法在室温下转移到光活性基底上。"
    },
    "type": "reasoning",
    "difficulty": 4,
    "topic": "heat_transfer",
    "quality_check": {
      "domain_focused": true,
      "domain_reasoning": "问题涉及沸腾传热理论、池沸腾临界热流密度、成核动力学、界面能分析以及沸腾曲线方程推导，这些都是传热学、流体力学和能源工程领域的核心专业知识，需要深厚的领域知识才能准确回答。",
      "answer_correct": true,
      "answer_issues": [],
      "other_compliant": true,
      "other_issues": [],
      "overall_verdict": "pass",
      "recommendation": "答案质量优秀，无需修改。"
    },
    "retry_count": 3,
    "question_id": "deepseek_q_eb75ced5",
    "source": {
      "type": "deepseek_generation",
      "paper_file": "Multifunctional-graphene-and-carbon-nanotube-fil_2019_Progress-in-Energy-and",
      "paper_title": "Multifunctional-graphene-and-carbon-nanotube-fil_2019_Progress-in-Energy-and"
    },
    "metadata": {
      "generation_model": "deepseek-chat",
      "created_at": "2025-10-15T11:38:30.969163",
      "answer_length": 790
    }
  },
  {
    "question_text": "论文讨论了石墨烯和碳纳米管在平面异质结太阳能电池中的等离子体增强吸收特性。请基于论文中关于金属纳米颗粒等离子体共振增强光吸收的内容，分析如何将类似的等离子体增强原理应用于燃烧诊断领域，开发新型激光诊断技术用于测量火焰中的温度和物种浓度。详细推导基于表面增强拉曼散射的测量原理和信号处理方程。",
    "standard_answer": "论文明确指出金属纳米颗粒具有等离子体共振特性，可用于增强光-物质相互作用。论文指出：'局部表面等离子体共振是当处于等离子体共振频率的光在金属纳米颗粒表面散射时激发的电子振荡'，以及'金属纳米颗粒的散射截面可能比物理截面大几个数量级，这是由于强烈的光-物质相互作用'。虽然论文主要讨论太阳能电池应用，但这些等离子体增强原理可迁移至燃烧诊断领域。\n\n在燃烧诊断中，可利用金属纳米颗粒（如金、银、铂）修饰的探针或基底，通过表面增强拉曼散射（SERS）技术测量火焰参数。测量原理推导：SERS增强主要来自电磁增强机制。总增强因子G ≈ |E_loc/E_0|⁴，其中E_loc为局域电场，E_0为入射电场。金属纳米颗粒的等离子体共振频率ω_p可通过调节颗粒尺寸、形状和介电环境调控，从而增强局域电场E_loc。当入射激光频率与等离子体共振频率匹配时，E_loc可增强10³-10⁶倍，对应G达10¹²-10²⁴。\n\n温度测量：利用振动拉曼散射的Stokes和Anti-Stokes强度比I_AS/I_S = [(ν_0-ν_v)/(ν_0+ν_v)]⁴·exp(-hν_v/kT)，其中ν_0为激光频率，ν_v为振动频率，h为普朗克常数，k为玻尔兹曼常数，T为温度。通过测量I_AS和I_S，可推导出温度T = -hν_v/[k·ln(I_AS/I_S·(ν_0+ν_v)⁴/(ν_0-ν_v)⁴)]。\n\n物种浓度测量：拉曼散射截面dσ/dΩ ∝ (ν_0-ν_v)⁴·|α|²，其中α为拉曼极化率张量。在金属纳米颗粒表面，由于等离子体共振增强，信号强度I_SERS ∝ G·C·(dσ/dΩ)，其中C为物种浓度。因此浓度C ∝ I_SERS/[G·(ν_0-ν_v)⁴·|α|²]。\n\n信号处理方程：考虑到火焰的瞬态特性，时间分辨测量需考虑信号衰减。瞬时信号强度I(t)满足dI/dt = -I/τ + S(t)，其中τ为衰减时间常数，S(t) = η·G·(dσ/dΩ)·C(t)·I_0为源项，η为收集效率，I_0为入射激光强度。通过求解该微分方程，可获得浓度随时间变化C(t)。优化金属纳米颗粒的形貌和排列可实现选择性增强，提高测量灵敏度和空间分辨率。",
    "original_text": {
      "1": "局部表面等离子体共振是当处于等离子体共振频率的光在金属纳米颗粒表面散射时激发的电子振荡",
      "2": "金属纳米颗粒的散射截面可能比物理截面大几个数量级，这是由于强烈的光-物质相互作用"
    },
    "type": "reasoning",
    "difficulty": 4,
    "topic": "combustion_kinetics",
    "quality_check": {
      "domain_focused": true,
      "domain_reasoning": "问题涉及燃烧诊断、激光测量技术、火焰温度和物种浓度测量，需要燃烧科学、光学诊断、等离子体物理和传热流体力学等专业领域知识",
      "answer_correct": true,
      "answer_issues": [],
      "other_compliant": true,
      "other_issues": [],
      "overall_verdict": "pass",
      "recommendation": "无需改进，问题和答案质量均较高。答案准确应用了论文中的等离子体增强原理，并合理推导了SERS技术在燃烧诊断中的应用，包含完整的测量原理和信号处理方程"
    },
    "retry_count": 3,
    "question_id": "deepseek_q_683f32b1",
    "source": {
      "type": "deepseek_generation",
      "paper_file": "Multifunctional-graphene-and-carbon-nanotube-fil_2019_Progress-in-Energy-and",
      "paper_title": "Multifunctional-graphene-and-carbon-nanotube-fil_2019_Progress-in-Energy-and"
    },
    "metadata": {
      "generation_model": "deepseek-chat",
      "created_at": "2025-10-15T11:38:32.732735",
      "answer_length": 926
    }
  }
]