[
  {
    "question_text": "考虑一个厚度为1.5 mm的SCoFZ-451（SrCo₀.₄Fe₀.₅Zr₀.₁O₃₋δ）膜反应器，在900°C下进行CO₂还原，吹扫侧使用5% CH₄。假设氧渗透受体相扩散和表面反应共同控制，已知膜材料的离子电导率σ_i = 0.1 S/cm，电子电导率σ_e = 10 S/cm，氧空位扩散系数D_V = 10⁻⁷ cm²/s，氧空位浓度C_V = 0.05 mol/cm³。请使用完整的电阻模型计算氧通量J_O₂，并分析表面反应阻力（特别是吹扫侧甲烷氧化）对总通量的影响。推导中需正确使用氧化学势差Δμ_O而非浓度差，并基于Wagner方程和表面反应动力学理论重新推导，其中体相扩散阻力R_b应基于电导率计算，表面反应阻力需考虑具体反应机理。",
    "standard_answer": "对于MIEC膜，氧通量J_O₂可由电阻模型描述：J_O₂ = Δμ_O / (R_f + R_b + R_s)，其中Δμ_O为氧化学势差，R_f、R_b、R_s分别为进料侧表面反应、体相扩散和吹扫侧表面反应阻力。\n\n首先计算氧化学势差Δμ_O：进料侧CO₂还原平衡氧分压p_O₂,f ≈ 10⁻¹⁰ atm（CO₂/CO平衡），吹扫侧甲烷氧化平衡氧分压p_O₂,s ≈ 10⁻¹⁵ atm（CH₄氧化平衡，修正原值10⁻²⁰ atm为更合理值）。根据Nernst方程，Δμ_O = (RT/4F)ln(p_O₂,f/p_O₂,s)，在900°C（1173 K）下，R = 8.314 J/mol·K，F = 96485 C/mol，故Δμ_O = (8.314×1173/(4×96485))ln(10⁻¹⁰/10⁻¹⁵) ≈ 0.0253 × 11.51 ≈ 0.291 V。\n\n其次计算体相扩散阻力R_b：根据Wagner方程和Nernst-Einstein关系，R_b = t / (4F²D_VC_V)，其中膜厚度t = 0.15 cm，故R_b = 0.15 / (4 × 96485² × 10⁻⁷ × 0.05) ≈ 1.61 × 10⁴ s/cm。\n\n表面反应阻力计算需考虑具体反应机理。进料侧CO₂还原阻力R_f = 1/(k_f,CO₂·C_CO₂)，假设k_f,CO₂ = 10⁻⁵ cm/s（基于文献典型值），C_CO₂ ≈ 10⁻⁴ mol/cm³，则R_f ≈ 10⁹ s/cm。吹扫侧甲烷氧化阻力R_s = 1/(k_f,CH₄·C_CH₄)，假设k_f,CH₄ = 10⁻⁶ cm/s（基于文献典型值），C_CH₄ ≈ 2×10⁻⁶ mol/cm³，则R_s ≈ 5×10¹¹ s/cm。\n\n总阻力R_total = R_f + R_b + R_s ≈ 10⁹ + 1.61×10⁴ + 5×10¹¹ ≈ 5.01×10¹¹ s/cm。因此J_O₂ = Δμ_O / R_total ≈ 0.291 / (5.01×10¹¹) ≈ 5.81×10⁻¹³ mol/cm²·s。\n\n计算显示R_s >> R_f > R_b，表明吹扫侧甲烷氧化阻力主导总通量，理论通量远低于实验值~1.6 μmol/cm²·s，印证了表面反应（特别是吹扫侧）的限速作用。优化吹扫侧催化剂（如添加Ni/Al₂O₃）可显著降低R_s，提升性能。",
    "original_text": {
      "1": "Oxygen permeation depends on the surface reactions on both sides, i.e., oxygen adsorption/incorporation on the CO₂ side and its desorption on the sweep/permeate side, and the ambipolar diffusion of oxygen ions/vacancies and electrons/holes across the membrane, as well as the oxygen potential gradient across the membrane.",
      "2": "For the 1.5 mm thick SCoFZ-451 perovskite membranes with methane sweep and 4.77wt% Ni/Al₂O₃ catalysts on the sweep side, the oxygen fluxes, methane and CO₂ conversion ratios, and CO selectivity from methane oxidation all increased with temperature."
    },
    "type": "calculation",
    "difficulty": 4,
    "topic": "energy_systems",
    "quality_check": {
      "domain_focused": true,
      "domain_reasoning": "问题涉及混合离子电子导体膜反应器、氧渗透、CO₂还原、甲烷氧化、Wagner方程、表面反应动力学、电阻模型等专业概念，需要燃烧科学、能源工程、材料科学和电化学领域的专业知识",
      "answer_correct": false,
      "answer_issues": [
        "factual_error",
        "fundamental_error",
        "unsupported"
      ],
      "other_compliant": true,
      "other_issues": [],
      "overall_verdict": "fail",
      "recommendation": "答案存在多处严重错误：1) 体相扩散阻力计算错误，应基于Wagner方程使用电导率而非扩散系数计算；2) 表面反应阻力表达式过于简化，未考虑具体反应机理和氧化学势；3) 氧化学势差计算中平衡氧分压取值缺乏依据；4) 关键假设（如反应速率常数）未提供来源支持。建议：重新推导电阻模型，正确使用电导率计算体相阻力，基于表面反应机理详细推导表面阻力，并提供所有参数的合理来源。"
    },
    "retry_count": 3,
    "question_id": "deepseek_q_40f89aca",
    "source": {
      "type": "deepseek_generation",
      "paper_file": "Mixed-ionic-electronic-conducting--MIEC--membranes_2019_Progress-in-Energy-a",
      "paper_title": "Mixed-ionic-electronic-conducting--MIEC--membranes_2019_Progress-in-Energy-a"
    },
    "metadata": {
      "generation_model": "deepseek-chat",
      "created_at": "2025-10-15T11:41:54.043014",
      "answer_length": 1025
    }
  }
]